ID,response
101,"The first time that Oliver learned of his power was in his senior summer of high school.  He was in the car with his friends on the way to the mountains.  His friend was driving a truck and they were on the road.  All of his friends were asleep save the driver because it was still early in the morning.  Oliver was sitting in the back right seat and was just about to doze off when he felt the car start to swerve off the road.  Something was happening to his friend Mason.  Mason, the driver was shaking violently in his seat and could no longer steer.  Somehow, Oliver knew to unbuckle himself, and exchange seats with Mason.  He didn’t know how, but he was able to unbuckle himself, then Mason, then switch seats with Mason all in the blink of an eye.  It was instinctual to him.  Oliver had always known that he was fast, but this was unhuman.  It happened so fast that no one even knew what happened.  They just woke up to Mason experiencing a seizure in the back seat.  Oliver then quickly pulled over safely and called 911.  The ambulance was there in no time and took Mason to a nearby hospital.  After he was safely in the ambulance, all of Oliver’s friends looked at him and asked how he was able to switch seats so quickly.  Oliver just shrugged and was at a loss for words.  He didn’t even know how he was able to move so fast.  
Oliver and his friends decided to still go to the mountains because that’s where Mason was being taken.  There was a nearby hospital up there.  Mason turned out to be fine and the doctors explained that he should be able to be released the next morning after they finished checking up on him.  That next morning, before everyone had woken up, Oliver decided to go on a run.  He wanted to test out his powers.  However, no matter how hard he tried, he could not seem to reach those breakneck speeds.  Sure he was running a sub five minute mile, but yesterday he could have ran a mile in under a second.  He returned back to the campsite to greet all of his friends.  One of his friends asked why he was sweating so hard.  Oliver just replied that he went for a run.  His friend jokingly asked if he was running at the high altitudes to become the fasted man in the world.  Oliver just laughed a little, but thought to himself how his friends would have reacted if they had only saw how fast he had moved the day before. 
That night, Oliver and his girlfriend Lori went on a hike to explore the mountain a little more.  They stopped by a couple of rocks in order to take a water break.  Out of nowhere, Oliver saw a mountain lion lunge for Lori.  It paws going straight for her face.  Lori was at least forty feet away.  There was no way Oliver could reach her in time, but he knew he had to try.  He sprinted towards her and felt time seem to slow down.  He was able to tackle her away right before the mountain lion would have gotten her.  He quickly got up and found the nearest large stick laying around.  The mountain lion lunged again, but Oliver quickly sidestepped it and smacked it across the face with the stick with lightning speed.  The mountain lion seemed to move at a snail’s pace compared to Oliver.  Then, the mountain lion, knowing it was beaten, ran off.  Lori quickly ran to Oliver and asked how he moved so fast.  Oliver was confused because he felt as if it was the mountain lion that was moving slow.  Then he realized that it was just all relative as to how fast he was moving.  Oliver learned that the reason he couldn’t run fast earlier that day was because he didn’t truly believe he could. "
102,"When a guy has his day, his day becomes one that will be remembered for life. For this guy, his day lasted for the rest of his life. Well, for Gary that is, but he just doesn’t know it yet. Gary is a well know chemical engineer at a nuclear power plant. Today will be his day, and tomorrow, and the next day. On this special day, Gary began his first day at work after his graduation. He was lucky enough to land a job right away, and this job was his dream job, soon to be life changing for him. On this day, he decides to take a risk, and his curiosity gets the best of him. He sneaks into the toxic waste storage room. While secretly examining barrels of toxic waste, he is suddenly pushed into one of them. Miraculously, his survives the toxic waste, only to find no culprit present. Worried he may lose his dream job for what his superiors may see as a lack of responsibility he does not mention the dunk to anyone and quietly leaves the room heading straight for the company showers to quickly rinse off and change his clothes. The day finishes with no one noticing his mishap. Upon leaving, he stares at his car while approaching. Touching the door handle, he realizes that his car is hot. It was a pretty cool day that turned warm, so he shrugged this off and gets in his car. On his way home, all he could think about was the sandwich his girlfriend, ex-girlfriend now, made for him the day before. He gets home and heads straight to the fridge. Getting his premade sandwich out of his fridge, he dazes out and stares at the sandwich for a while, thinking of his recent girlfriend that left him yesterday. Suddenly snapping out, he goes to eat the masterpiece. While chewing he notices a weird, unexpected feeling in his mouth. The sandwich is hot! He spits it out. “How can this be!?” he wonders. How could a sandwich that has been in the fridge for two days be hot? He dazes out and stares again, this time at his coffee pot full of old coffee from that morning. He snaps out again and goes for the coffee pot. Its hot too! He has radiation powers. The end. "
103,"I was walking to class as I normally do but something felt strange. It was hard to hear my own thoughts and I was not sure why. It seemed as if there was a bunch of mumbling coming from all directions making it difficult to focus on my own thoughts. I decided that I should get some coffee, maybe to wake myself up so I walked to the Arbor and stood in the long line of college students waiting their turn. The mumbling sounds had not gone away; in fact, they were becoming stronger as I got closer to more people. I could actually make out what some of the mumbling was saying. It was completely quiet around me, as everyone was so tired, hence they were in line for coffee but I specifically “heard” someone saying how tired they were and another complaining that she was going to be late for class because of how long the line was. I turned to look at the people in line and it appeared that none of them had said anything. Confused, I asked the girl behind me if she had heard someone complaining about the length of the line. She gave me a strange look, as if I were crazy and replied that she had not heard anyone say that. She continued to look puzzled, as if I had scared her and finally she taps my shoulder and says that she had specifically said “Ugh this line is so long, I am going to be late for my chemistry class” in her head. It was at this point that everything was starting to come together. I was no hearing people talk, rather I was hearing their thoughts. 
After grabbing coffee, I walked to my first class, physics, and sat in my usual seat next to the cute boy in class. I wanted to see what he was thinking. As soon as I sat next to him, his thoughts were blasted at me. It appeared that he was always thinking about something, first about how he really needed to do laundry, then about him and his girlfriend fighting (ugh I didn’t know he had a girlfriend already). It became so distracting that it was nearly impossible to concentrate in class because I was hearing everyone’s thoughts as I was trying to listen to the lecture. People think such strange things during lecture, you would be surprised. Some of the guys were thinking about how cute the professor was while others were doing the math problems in their heads. It became too much for me so I ended up leaving class early. 
All I needed was to find somewhere with no other people so I could relax and hear my own thoughts rather than everyone else’s. Some people wish for this to be their superpower, myself included, but I have not yet learned how to turn this power on and off. If I am able to teach myself this, then it will be cool to be able to hear people’s thoughts, however if I am always hearing what others are thinking it will be nearly impossible for me to get anything done, and I will quite possibly go crazy. 
I began to think that maybe something was just wrong with my head but then I remembered that the girl in line for coffee was thinking what I heard. This means that I am not in fact going crazy, rather I have just developed a new power. I tried to think of how this could have happened but I couldn’t think of any probable ways. Maybe some kind of insect bite like Spiderman, or maybe someone slipped a drug into my drink. It began to really worry me so I decided to go to the doctor’s office the next day. "
104,"As Zayna takes the bus to her tedious job in the city, she takes her time to leisurely people-watch. The commute is an hour north into the city, so she often sees a gradient of various types of people. She judges a woman with a large pink sunhat and takes note of the man in the corner by the exit, who oddly resembles Snoop Dogg. She questioned of the authenticity of the celebrity, but was confirmed of his identity when a young fan yelled, “SNOOP”, to which he responded. After signing the autograph, Snoop Dogg turns and glances at Zayna, but Zayna did not look at Snoop, instead, she hears a voice coming from the man’s beard.
“Zayna, what’s good, it’s the D-O-double G’s beard and listen here yo, you got a special thing going on in your brain right now yo, listen, you gotta utilize”
Zayna hesitates, she murmurs to herself, “what the….”
“Yeah homie, you got this talent, you can make beards GROW. And you know, my man Snoop here doesn’t take very good care of me, you see me right now? I haven’t been washed in MONTHS. This dread thing ain’t a good look for me girl, you gotta help me, you gotta help me GROW. I wanna look like repunzle, like the girls in the movies, like my girl Kim Kardasian (who I saw yesterday but don’t tell Kanye that). So what do you say, Zayna, will you help me? Use your telekinesis!”
Zayna, bored on her commute, was fascinated at the new opportunity for a new hobby. She focused her mental energy on growth to the talking beard. She gathered the powers of keratin, testosterone, and GHC (the growth hormone), and tunneled the ATP through her eyes. Her energy gathers until she bursts out, “MITOCHONDRIA IS THE POWERHOUSE OF THE CELL” and suddenly the bus shakes and shifts and Snoop Dogg is grasping onto the bus railing as his beard yells, “WOOOOOOOOOO” and grows 20 feet longer. 
Zayna is stunned by the transformation, and decides to spend the rest of her commute sparking hair growth to unsuspecting victims. 
Eight years later, Zayna sits in her empty apartment eating a TV dinner, watching the news about a woman named Zayna, wanted for crashing the economy after her acts of hair growth had spiked the cost of hair removal products. "
105,"Jessica woke up one morning and proceeded to the bathroom to brush her teeth. All of a sudden, she looks up at the mirror and sees nothing…She thought she may have been dreaming or just woke up on the wrong side of the bed that morning. She went downstairs and said “Good morning” to her mom. Her mom yelled “good morning, come downstairs for breakfast!” Jessica was downstairs.. She didn’t say another word. She went back upstairs and pinched herself. She was awake. Something was up. She went back to the mirror, saw nothing again..She pinched herself in front of the mirror. She felt the pinch, but saw nothing. She started wondering if some supernatural force was responsible. She began to wonder if she was now invisible… She drank some water and felt the refreshing and crisp taste go down her throat. Her physical body was still there, but why wasn’t It visible to anybody.. 
She yelled “bye!” to her mom and went out from the backdoor to go to school. She had to figure out what was going on. She walked to school and people almost bumped into her along the way. It was almost like bumper cars, and Jessica had to avoid them, since, they could not see her.  However, one man did bump into. And this made her body come back. He turned around and said, “I’m so sorry honey.” People along the way now smiled at her, and she realized she was no visible again. She was happy, but wondered if she could switch off between invisible and visible..because having the power to be invisible sounded pretty great to her…
She said out loud “invisible!” and she immediately could not see her arm anymore. She hit her arm, with the same force as the man who bumped into her and brought her body back, and she saw her arm once again. She repeated this 5 more times. She realized she could be invisible when she wanted to and come back when she wanted to.
Later that day she said “invisible!”. She could not see her body any more and she was ready to use her powers to her advantage. First, she went to her all time favorite but super expensive clothing store. She took a few article of clothing, walked on out, and giggled. She thought this was amazing. She then decided that she should spy on some people of interest.
She was dating a guy Jason, and was really into him. But she wasn’t sure if he was seeing any other girls and it was too early in their relationship for her to ask if they were exclusive. This was the ultimate time to find out. She went to his house and stood in his room for about an hour. She adored him, so this wasn’t necessarily boring. He then made a phone call. The person on the other end picked up, and it was his best friend Max. They started to have a boring and simple conversation. But then the conversation picked up and Jason brought"
106,"There was once a girl, an everyday ordinary girl who did not have any thing that made her particularly unique or different from her peers. She went to a good school, had friends, loved her family, and generally did what was expected of her. From the outside this would seem normal and all fine and dandy, but on the inside this girl felt as if she was insignificant, she felt as if her existence was meaningless and she had no place in the world. She wanted to make a difference in the lives of others and be someone who was remembered by her peers and by those in the years to follow. 
To change this, she decided to study her chemistry book and use her knowledge to concoct a solution that would give her the ability to read at a superhuman rate and know everything she studied just from hearing it or reading it one single time. She hoped this would allow her to excel in her classes and be able to use her knowledge to better the world. Now this might not seem like the best or most extraordinary superpower to work so hard to get, but to her it meant she could continue on living a regular lifestyle and make an impact on the lives of others without carrying the responsibility of being a celebrity mutated superhuman. She could use her knowledge to help improve the health and wellness of those around her without having to deal with the stress that comes with studying and being a student. Rather than spending her days in the library overwhelmed by her surroundings, she could instead devote her time to helping others and providing them with the expertise they need to better their lives. 
This power proved to be beneficial once she happily graduated with all the happiness and energy she needed to go to a third world country. She provided them with the knowledge they needed to better their health and nutrition and also helped them to understand themselves psychologically. She knew every answer to every question and was able to use her knowledge to creatively provide solutions to their problems. Where ever she visited the people always were left better off. "
107,"Angel
There was once a young woman who spent living 35 years of her life entertaining people and making them happy. She would always have a joke for the people who lived in her town. She loved to see her friends and family laugh at all her jokes. This woman, Angel, became so well-known in her small town. One day Angel came home from work shocked and worried. She walked into a house of darkness and silence. No one was home. Not a single sound could be heard within the walls of her home. She wondered where her parents were. Angel walked outside and knocked on the neighbors’ houses and not a single door opened. She began to worry. Her heart racing. Her body sweating. All of a sudden, Angel passes out. When she wakes up, she is not able to move. She can see her surroundings. She can see who is crowding around her, but she cannot move a limb. A strange woman in the crowd speaks to the rest and says, “SHE HAS AWOKEN!” A clueless Angel is wondering what the hell is going on. “Why can’t I move?”, Angel said. Another strange woman responds to her, “Our dear Angel, you have been given a gift”. “A gift?”, ponders Angel. The strange woman explains to Angel of her duties. She says, “Everyone in your past life is gone. They have all disappeared. It is up to you to bring them back. You have given the power to bring them back, but there is one condition—YOU, Angel, must find your true self.” Angel ponder, “My true self? What do you mean?” The strange woman responded, “Your true self, Angel. In your past life, you were the type of person to entertain and make everyone laugh and smile. But were YOU smiling? Were you happy? In order to bring your loved ones back, you must find who you truly are by using the power given to you.” Angel thought very hard about this. She knew she was a broken machine on the inside. She may seem happy on the outside because all she knew how to do was make people happy, but what about her own self. What about her feelings on the inside? Angel has always struggled in her life. She never could pick herself up again after her first year of college. The only thing she could do was to make others happy by making them laugh even though she was dying on the inside. Angel began to think about all the possibilities. She had to. She needed to. If she wanted to save her friends and family, she had to become selfish and find herself. It was the only way to bring her loved ones back. All her life, she focused on the well-being of others and never hers until the day she realized that she herself must be taken care of as well. With the power given to her by these strange women, Angel was able to find herself and realize that self-care is important. She was able to realize that she must be selfish at times so that she can be happy too along with her loved ones. Angel became the angel of her town saving the lives of everyone who lived in it. She finally became true to herself."
108,"She never really understood her powers. She was so young and her mother always blamed it on her imagination. She always told her to keep her mouth shut and to focus on what really matters, which to her meant school. But to Emily, what really mattered was her ability to be different. Everyone thought she was kidding when she told them about her superpower. They called her crazy and told her she was being ridiculous. No one ever really said things directly to her but she always heard it. This is why her power was a blessing and a curse, because she had the ability to hear everyone even in the quietest of rooms. She heard every single thought, saw every single memory, and understood everything in ways no one else would know. Luckily, her best friend always believed her and Emily listened to her every day in hopes that this belief would never change. 
On this day, Emily was minding her business as usual when the school bully approached her and said to her, “Bet you can’t guess what I’m thinking.” Emily knew this would only end badly but she knew that if she didn’t stand up for herself then she would only continue to be bullied. Still, she was afraid."
109,"Sandy Miller was just an ordinairy seventeen year old, about to face her biggest challenge yet, senior year. Sandy was especially nervous since she would be transferring high-schools after her Mothers job as a financial manager was re-located. Although the Miller’s seemed like a typical well-off American family, they kept one family secret from the world, that only relatives knew of, the Millers could read minds. 
Mind reading was no hard task for the Miller’s. If they put a fraction of their attention on a person and tried to hear their interpersonal thoughts they would be able to interpret everything going on through the persons mind. The only limit was that the Miller’s were unable to read each other’s mind because of the family tie.
Sandy was used to the routine of moving schools. She would avoid the mean girls, and try to make a few friends, none of which she felt especially close with or kept in touch while changing schools. Her plan was interrupted because on the first day she was partnered up for a Math assignment in Calculus with Maya Downfraud. Maya was known as the schools queen, literally and figuratively since she had won Queen at junior prom the previous year. She was captain of the soccer team, maintained a 4.0 GPA unweighted and was the President of many clubs including National Honor Society. Although Maya was quite accomplished, she also tried to dominate anybody that posed as a threat to her standing in any association, and especially to anybody who tried to compete with her GPA.
Sandy had been the valedictorian of her past schools for Junior and Senior year, and had been warned about Maya’s competitive side. Maya introduced herself to Sandy and made sure to explain all of her achievements, then warned her to not score as well on tests and told Sandy to choose a class to get a B in to lower her GPA.
Sandy was flabbergasted. She could not stick to her original plan. She had to get through to Maya and change her evil ways. The following day Sandy and Maya met after school at the local coffee shop to work on their math assignment. Upon arriving she read Maya’s mind. Maya was scared, she would be the first in her family to go to college and was trying to rack up every scholarship she could get, which is why her achievements had a high priority in her life. Her parents were illegal and paid less than minimum wage. Maya saw college as her escape and opportunity to go further in life then her pregnant eighteen year old sister and drug addict brother. 
Sandy understood Marta’s dilemma, but knew that changing Sandy’s GPA would not affect Maya’s college opportunities. An hour into working on the assignment Sandy asked why Maya cared so much about her GPA,  but Maya just said “you wouldn’t understand.” 
Sandy finally said I’ve been looking through some scholarship opportunities that I wouldn’t be able to get since I’m not very involved in school, but they would be perfect with you because eof all your accomplishments."
