ID,response
68,"Her name is Alex. She is 20 years old attending university at SDSU and she was an average student, ran track and was very social and well known at her school. One day she severely broke her ankle during practice and, after casting her ankle, her coach told her she was out for the season for injuries. Devastated, Alex went to a therapist to talk about her disappointment and to discuss the anxiety she was feeling from her inability to participate in her sport. The therapist put her in a hypnosis state in order to get to the depths of Alex’s increasing anxiety. Unaware of what she told the therapist during her first hypnosis, Alex left the office after her session and went on with her day. Later that night, Alex was washing her dishes after dinner when she picked up a pan and completely bent the handle. Unaware of why or how she even did that, perplexed Alex eased her grip and figured the pan was just old. But as she continued her night, she started to realize the extent of her new found strength. Things that she would pick up that normally were slightly heavy, became a breeze to carry, and her ankle’s pain was progressively diminishing. Shocked, frightened, but extremely intrigued, Alex starts testing her limits with this newfound power. She could pick up her fridge, she could move her huge couch, and there were seemingly no limits on her new strength. But where did this come from? How did this power randomly appear and how was she getting more and more strong as time went on? Could she control it? Would this mean that Alex could possibly get back into her track season before it was too late? What would she tell her coach? “Hey coach, I know my ankle was shattered yesterday but I woke up with insane strength and my ankle is completely healed.” Now she just sounds like a looney. What could she do with this. Alex called up her therapist and told her what had happened. Her therapist seemed to have been awaiting her call, she knew the gift she had given Alex. She told her to use it for good, to save people and to help her team, and to use her strength to benefit society. So Alex, finished out her season, graduated college, and went on to be a fire fighter. She saved more lives than any of her co-workers, male or female, because of her incredible strength to knock down walls and carry multiple people out at once. This gift, this power she attained not only saved Alex from anxiety and depression, but helped keep her community safe."
69,"Caroline was an average girl who went about her days with average thoughts and average actions. She came home to her average family and talked about her average daily happenings and went to bed dreaming average dreams. That is, until one day she woke up feeling different. She didn’t feel average. She opened her eyes and found herself staring at the ceiling just as she usually does every morning when she awakes. But, something was different. This time, the ceiling was merely inches away from her face. Caroline was floating! Upon this discovery, she flailed her arms and legs about and screamed. What was happening?! She looked down at the ground – what seemed miles and miles away from her body – wishing for the comfort of her feet being planted on the hardwood floor of her bedroom. Both of her parents had already left for work and she had no one to help her on this seemingly average Saturday morning. Caroline willed with all of her might for herself to gently glide back down to her bed. And just as she willed for it to happen, it did. She remained calm and waited for her body to slowly sink back to the warm embrace of her comforter. She then sat upright in bed, examining her hands and feet. She ran up to the full length mirror on the other side of her bedroom and stared at her perplexed reflection. Nothing looked different. She still had the same shoulder length brown hair, same dull brown eyes, same height and weight, same normal looking clothes. But, she felt different. An unknown energy coursed through her veins. She contemplated trying to make herself levitate again. And just as soon as the thought reached her mind, she felt her body lift off of the ground. She was levitating in the center of her room. She thought about moving over to the left and as soon as the thought crossed her mind, it happened – all with the control of her own. For the first time in her life, Caroline did not feel average. She felt extraordinary. She felt powerful. She felt different. She could fly! Caroline decided to take her powers out to her backyard where she could hone them – though not much more of that even needed to be practiced as she seemed to be in complete control of her thinking and movements. She dashed to the privacy of her backyard, but then decided that she could just fly there instead. Without anyone there to witness her newfound power, Caroline flew around the backyard. She flew right and she flew left, up and down, all around. She flew so high that she knew everyone in the world could see her if they would just look up and notice her. But, of course, they did not. No one looked and no one gawked. Caroline slowly drifted back down towards her grassy backyard. With the weight of what she had just realized weighing down on her, she slowly sulked back inside her house towards her bedroom. She thought that her power was useless if no one else was around to appreciate it. But, as the moments ticked by and she processed what was happening to her, she changed her mind. She was wrong. Of course, it still mattered. Whether or not other people could see what she could do did not determine whether or not she could still do things. Being able to fly without people knowing is much better than not being able to fly and everyone knowing that she could not fly. Who cared if no one would believe her? She could do something no one else could. She could fly. And with that thought, her body began to float with all the ecstasy of her epiphany."
70,"Hovo Kyurkchyan
The day just started. His alarm screamed at the top of its lungs at 5am just like every other morning. He got up and started his daily morning routine. First he showered, then got dressed and headed to work. On his way to work he stopped at a hotdog stand. “Hey Sam!” said the owner of the hotdog stand like he did every day. As usual, he got a regular hotdog with ketchup. 
Sam lived a dull and alienated life; same routine every day…. Until today. On his way to work, Sam tripped on a bump on the sidewalk. Suddenly, while falling, everything around him stopped: the people froze, his hotdog which flew out of his hand froze, the cars froze, and everything just froze (except Sam). He caught himself mid fall and realized that everything had stopped. He did not know what to make out of it, so he just started running. As he ran, it seemed like everything was speeding up, that everything was being fast forwarded. Sam stopped in his tracks and everything turned back to normal. He looked at his watch and noticed that over 2 hours had passed as he ran for about 2 minutes. 
What should he make of this? “I can control time?” he thought to himself. He decided to call in sick to work and explore his new findings more in depth. He walked back the way he came and tried to trip on the same bump he tripped on before, but nothing happened. He then tried to run, but nothing happened. He eventually got home and sat on his couch, trying to comprehend what had taken place. So he closed his eyes and tried to concentrate. He tried to stop time as he did before, but he couldn’t! He tried for hours on end. Sam got frustrated, so he grabbed the glass he had been drinking water from and threw it across the room. As the glass flew, time stopped. Sam walked to the glass and grabbed it. He looked at his clock, and it was still. 
Sam realize his powers are triggered when he does things instinctively. He thought that he should use his powers for good, so one night he put on a hoodie and headed for dark allies. He walked until he saw a drunk man about to strike a woman behind a bar. Instinctively, he tackled the man and time stopped. He then tied up the man, took the woman’s phone, dialed 911, and placed it in her hand. He then ran away, which speed time up, when he looked back, the police had already arrived and arrested the man. This was the birth of the superhero, Father Time."
71,"It was very strange the way I could understand people’s feelings. Everyone said I was only being intuitive and sympathetic, but anytime a person around me was feeling some strong emotion, I could sense it as well, even if no one else could. I first noticed this at school, when my friend JC was upset and I asked him what was wrong and everyone around me looked really confused. “What?” I asked them. “JC is fine, he just made a joke to us about his cousin,” another friend stated. Later on, JC had told me that he found out he was moving to another state next year and that it was very strange that I had known, since he was trying to be secretive about it. 
Things like this happen to me on a daily basis and I became known as “the Therapist” because I was really good at understanding people’s feelings, but something felt different after last week. All of a sudden, I could see faint images when observing people and trying to determine their feelings and emotions. They were images that I had never seen before, maybe in a dream perhaps. This was all very strange for me and I hadn’t realized what was going on until I had seen the strongest image yet. It was when I was looking at my sister. She’s a baby and of course has no way of telling me how she feels, but when I looked at her and tried to determine her feelings, it was then that I realized I was reading her mind. I could see what she was seeing, all from her own perspective and could literally picture her feelings in my head. I was astonished to find out that it was possible to have something like this. Everywhere I go, I’m bombarded with images and feelings and scenarios in my head, none of which are my own thoughts or from my own brain. There’s no one I could tell about this, of course, but just knowing I have this power is something I would’ve never imagined. "
72,"It had been a disastrous week, and once again, he found himself running for his life. He thought to himself of how he could have avoided all this trouble if he had simply decided to mind his own business and not listen in on the conversation the group of strangers have had. Now here he was, running through the cold lonesome night being chased by these strangers who unknowingly had turned out to be mobsters. He thought back to the time where he was a kid, the very limited memories of his parents and how tragic his life had become since the day of their murder. He knew he couldn’t let what he had heard from the mobsters happen, he had to do it in honor of his parents and prevent the mass shooting they planned to do in city hall. As he ran down the dark alley he came to a dead end with the mobsters’ right behind him. With almost little time he reacted and entered the abandoned factory to his left through a broken window. As he jumped down he landed in a boiling pit of toxic waste. He screamed in agony as his skin burned in pain and his cells became flushed with radiation from the waste. Suddenly he awoke from his sleep, it was morning. He felt sore and weak he needed to find something to eat. As he settled out through the window he jumped down into the alley but as he landed he dislocated his foot. He did not feel pain. He simply jammed his ankle back in place and carried on. He began to think of the beating his foster parents would unleash on him for not having come home the night before but he had no explanation, they never believed him either way. He got home, where they awaited for him with a heated iron rod in hand awaiting his punishment. Once again he felt no pain but decided to lay a shriek in order to ward off his foster mom from continuing with more severe punishments. Later that day he realized that the toxic waste had changed his anatomy, he seemed indestructible. He decided to test what else he was capable of doing he bashed against his basement wall and broke it and underlying old secrets. He found old newspaper clippings of his parent’s death and there he found that the murderers had been the mobsters from the night before who had escaped prison based on a technicality. He decided it was time for him to do something and seek justice for what they had done to their parents and avoid deaths of others, avoiding their children to go through what he had gone. Off he went in search of the mobsters and finally he found them preparing to follow through with their plans for the massacre. Equipped with only a red mask over his face and the metal rod which he had been punished with he unleashed his fury upon them. One by one he fought off taking few gunshots to the body but they failed to stop him. He felt no pain. He wiped them out entirely and thought to himself of what a hero he had become. His idea for justice had been overtaken by revenge and he felt good about it. He took one step and fell to his knees. Memories of his parents flushed his mind and this time he did not cry. Pain was eradicated from him both mentally and physically. He was no longer a nobody."
73,"It was just like any other day for Rhonda Rotter, she was in school, daydreaming about all of the other places she would rather be. This particular day, the class was talking about tropical environments and their effects on animals and climates when Rhonda found herself in a rain forest in Chile. This was unlike any normal daydream she usually had but much more visual – she could feel the moist air from the sky and smell the dewy trees and plants around her. She tried to wake herself up; she began to pinch herself in order to appear back in her school classroom, but nothing was working. Suddenly, she saw a monkey in front of her, swinging across all the trees in the rainforest and finally setting his eyes upon her. She stood still for a while, still believing this MUST be a dream. The monkey soon jumped on her, and there was no hiding that she was no longer in the class but in an actual rainforest where she had been daydreaming about! The monkey was real as was all of the environment around her. Rhonda realized now that she had a special ability to teleport wherever she wanted to during her daydreams. In order to test this realization, Rhonda once again began daydreaming of somewhere she wished she could be and when she regained conscious control of her thoughts again, she found herself in Australia surrounded by Kangaroo’s along with the joey’s which lay in their pouches. The mother kangaroos thought she was there to attack their offspring though and took action, encircling her, threateningly. Rhonda knew what she must do, and in order to get out of there as fast as possible she immediately started daydreaming about the last place she felt safe so that she could go back to that place. When she regained consciousness once again, she was back in her chair at school and her entire class was waiting for her to answer her teacher’s question, “If you could be in any place in the world right now, Rhonda, where would you be?” Little did Rhonda’s teachers and classmates know - she could now go anywhere she wanted."
74,"Jill is a 13 year girl who lived in a small city in California. Since she was young she knew something was wrong with her. Every time she touched something it would get really hot and eventually if she held it for too long it would begin to melt. Jill was ashamed of this “power” that she had. She made no friends in school because her bright pink hair would scare everyone off. The good use she found for her power was that she was able to heat up food with just the power of her hands. Jill eventually built magic gloves that allowed her to touch things without burning them. Jill lived on with these gloves till her high school days but she would doubtfully be teased for always wearing those creepy looking gloves. She wanted to take them off so badly but knew that if she did she would become this monster that only set things on fire. She was unable to live the normal teenage life. Jill was never asked to dances nor did she make any friends until Jeremy became a new student in the school. From the gecko, he found Jill to be a very interesting girl. She was amazed by her bright pink hair that lit up once it was in the sun. One day he approached asked her name and why she didn’t seem to talk to anyone. She explained to him that she wasn’t like the normal girls that went to the school. Jeremy continued to talk to her and eventually Jill came to trust him and showed him the power that her hands withheld. He was so amazed and said “that is so amazing.” Jill explained to him that it wasn’t it because her power just made her this freak that burnt everything she referred to herself as a devil girl that brought no good to the world and Jeremey yelled “You are not evil. You think that your power of fire is bad? I don’t see this as the power as fire but I see it as light. You have the power to turn things on, to light up what is dead. Don’t you see you are light. You brighten up the world with that power that you withhold.” Jill was shocked. She never thought that her power had anything meaningful to it until Jeremy shed his own “light” upon her. She realized that she was the light that brightened up the world. With her power she was able to brighten things that had no life within them anymore. "
75,"  Jimmy wakes up at seven in the morning as he usually does on Sunday mornings. He is preparing to go on a morning run with his dog Wolfy. Jimmy’s run takes about one to two hours, this includes his stop by the local bakery on the way back home. He slips on his Adidas running shoes and heads out the door. Jimmy has been looking forward to this run all week because he’s been embodied by stress as it has been election season. Jimmy dislikes the two frontrunners for the top two competing parties, therefore he joined the race to presidency as a third-party member. He’s done very little advertising and spent very little money. All of his campaign has been ran through the use of social media; twitter, Instagram, and Facebook. Jimmy knows the chances of him winning the elections are about the same chances of him winning the lottery. He walks out the door and begins a slight jog down the street. The sun is bright, the streets were clean, and the trees were green, he waved hello to Mama Joyce who lived in the yellow corner house. It was a normal Sunday, once they reached the local park, the slight jog transformed into a sprint and Wolfy had clearly been working on his cardio as there is no sight of him being tired soon. 
  Jimmy returns home with a shirt full of a sweat, an exhausted Wolfy, and a bag of sweet bread. He turns on the TV to see his face on every channel reading “President Jimmy Jim”.  Words were nonexistent at this time, jimmy lost feeling in all his body and fainted. He gained consciousness and managed to realize he was now in charge of an entire society. His confidence grew and he kept his same routine on Sundays.   "
76,"What was going on?
First there was an alien invasion, then there was that weird announcement, then there were the floating rocks in the sky, and finally there was this. This thing floating in front of her. Cordelia didn’t really have a choice in the matter, did she? It was touch the capsule and probably die, and it was walk away from the capsule and probably get murdered to be someone’s last meal. 
At least this way she knew she probably wasn’t going to be bitten death. 
--
That had been two years ago. Two years before she invaded Nightingale March and two years before she’d found herself here, after dueling Reina for their lives and emerging victorious. This was the first time in those two years she’d ever willingly killed. 
Man, those star people were messed up, if they terraformed planets and blessed—or was it cursed?—native sapient species with supernatural powers for their entertainment. But for the chance at one, limitless wish? Cordelia thought being a puppet in a show was worthwhile.
But now was not the time for that. Now was the time to be confused. Out of Reina’s limp form a glowing flower was blooming, facing towards Cordelia the way other flowers face the sun. 
It beckoned her. In some way that Cordelia couldn’t understand, she felt compelled towards it, to touch it and see what would happen. 
It wasn’t normal for flowers to bloom from dead people, even if they had Auras. She’d seen enough people die to know that. June, Apex, and Charity were all such people, had all been her friends, and never once had Cordelia seen this. 
She touched a single petal of the unearthly flower, and everything spun. The air as knocked out of her, and as she fell it felt as though she was being kicked down and someone was stepping on her chest. 
A trap? Energy had been Reina’s element, after all. 
But it was over too soon to be a trap, and Cordelia’s glove and the gem embedded in the back of her hand had both changed. The deep brick red was flecked with gold, the same gold that lined Reina’s mirror. 
The earth was not Cordelia’s in the way energy had been Reina’s; the earth had never been hers in that way. Cordelia dominated the earth, did not nudge and prod it like Reina did energy, and something told her that she, too, could now dominate energy. She could dominate anything, but she would have to kill for it.
Too bad Phantom was dead. He’d have applauded her now."
77,"There once was a girl named Madeline. She always knew something was special about her, as if she had some greater, unknown purpose. She dabbled in her own fantasy worlds, always believing that they weren’t too far from the truth. She believed that there would be something greater for her, something that was magical. Although, she dreamt of this, none of her dreams ever came to fruition. However, she would still go about her seemingly mundane life and exude magic. This magic was not supernatural magic, but her own, a magic that came from her own light that she emitted. One day, as she was walking to school, she did nothing different from her typical routine, however, something was different. She felt as if the world had changed overnight, like maybe everything she had ever hoped for became a reality. She walked to school, sat through eight hours of 9th grade material, and walked home. She was disappointed that her intuition proved to be wrong, but she was unprepared for what came next. She went to take her dog for a walk and saw new surroundings. Maybe not a new driveway, or new people, but a new view. Everything was more vivid and more beautiful. She felt like she was truly seeing for the first time in her life, not just with her eyes, but with every part of her being. And suddenly, time stopped. Everything around her was frozen and she knew. She knew her purpose and what her abilities were. She realized that she could stop time, fast-forward, and rewind. Not only did she have this new ability, but she finally understood herself in such an extraordinary, insightful way. Nothing was ever the same. After that, she went about her days as usual, but now she was able to see the beauty in time and the beauty within herself. Her powers weren’t just about having some cool, unique ability, but about being able to understand the world better so that she could help others to understand how she understood. She could never articulate what this all meant, but all she knew was that there was something special brewing, something that could change the world. She could change the world. As misunderstood as she was and as misunderstood as she was about to be, she took solace in the fact that she was special. This didn’t satisfy her in such as she was better than everyone else, but that she saw everything so beautifully and could possibly get others to see what she saw. And maybe all along, this was her purpose: not to travel through time all on her own accord, but to teach people about what she learned along the way. Truly, she was given the gift of sight, the gift to see the world through a magical lens. She was given happiness, she was given truth, and she was given empathy, beyond what anyone else ever thought they knew. She traversed the world and surprised others with her inner beauty. She gave people things that they always wanted, but could never get: someone who would love them unconditionally on their own terms. She looked at people and saw them for who they were, who they are, and who they could be. She smiled at people with enough love to last a lifetime, all because she knew, she knew what truly mattered in life. She was able to strip the world of misconception, materialism, and greed, and see what it all amounted to. She lived her life with a fervor and a drive that inspired people and gave them the unexpected. People could feel her love emanating, and she could feel everything that they felt and see what the world had in store for them. And she could just stop in time and look around along the way. She was free."
