ID,response
36,"Once there was a girl. She was walking home from school on a rather uneventful day, wondering how life could be more boring or repetitive than it already was. Staring at the houses that looked the same, the streets that looked the same, the trees, the flowers, the lampposts that all looked the same, she stumbled upon a rock- which did not look like any normal rock. 
Just based on appearance, this glass rock with a fire burning within it awed her. FINALLY, she thought. Something peculiar and interesting in the middle of my mundane life. With curiosity and wonder, she picked up the rock, examined it, and put it in her pocket. After a couple of days, this rock didn’t seem to do anything at all other than look beautiful. She frustratingly threw the rock away and it burst into a huge fiery ball, engulfing her for just a second, and then disappeared. 
“This is something straight out of a superhero movie! I’m going to have the ability to breathe and control fire, humidity, and nature! I’m going to make the most of my life, saving lives and creating a beautiful world!” But she was wrong. 
For the next couple weeks she noticed nothing strange about herself at all. There was no change in her abilities, and she continued to live a painstakingly boring life. Was the rock just a dream? Did she imagine it happening to her purely because her life was just that pathetic? Maybe. Maybe not…
As college acceptances rolled out, her & her best friend were walking around college campuses, discussing which schools they thought they would be accepted to. “I have 0% chance of getting into any college, I swear…” She had no confidence in herself or her future. 
And she was right. Out of the 21 colleges she applied to, she was accepted to absolutely none of them. Her future was going to be living in her parent’s basement until she died alone. 
“How could this be? How can I have not even been accepted to a single college? This has got to be a mistake. I’m 100% sure I could have been accepted to all of these. I can’t believe this.” 
And… she was right. A couple days later, all 21 colleges sent her acceptance letters in the mail, telling her they had made a mistake and would love for her to attend their college. 
-Narrator’s cut- 
You’re probably wondering what’s happening right now. Well this girl (let’s call her Jackie) has just obtained the power to make statistics come true. She doesn’t know it yet, but this could be the greatest power of all, she could potentially say “There’s a 100% chance that I will close my eyes, and open them again to find myself in Ethiopia”, and that would come true. Or “There’s a 100% chance that I will be able to fly and soar throughout the sky”, and she’d find herself amongst the birds and the clouds. If you really wanted to take it to the next level she could say “There’s a 100% chance that anything I think about or imagine in my head, will come true as long as I say it aloud”. And then she wouldn’t even have to manipulate statistics anymore, she would just have to say everything out loud and it would be done. 
So, let’s find out what Jackie chooses to do with her newfound power…
Fin. To not be continued. "
37,"She paused, staring at him with a frown that creased the sliver of flesh between her eyebrows. What was wrong with him? All she ever wanted to do was help, and he stood there, daring to deny her the use of her newfound ability. The cut on his hand was fresh, dripping with blood that could have well been made from droplets of rubies. He could sense what she was mulling over in her head and sternly said her name, as if it was a warning; “Kalani.”
The woman cleared her throat and looked back up to lock his amber gaze with her cinereous one. Kalani had been in charge, once before, and now this man she had grown fond of was so locked in on his own superiority that he felt as though he could order her to do anything. But she wasn’t one of his lackeys, one of his dogs that he could command and growl at. The blonde had slowly caught on, and she knew that he was fond of her as well. If he had any sense left in his bones, the Captain would not deny her the use of her power. 
Still, she didn’t know the extent of what she could do. Not until that moment. At first, she noticed her own bruises disappearing in a matter of moments, small cuts closing up like they were never meant to brandish her skin. But was it possible for her to heal others, specifically the man before her whose rougue-ish look took her breath away? He dared say she couldn’t, and the look in his face told her that, even if she could, he didn’t want her to. 
Again, he spoke her name, much firmer than before. “Kalani, don’t.”
With as little response as she had self-control, the woman snatched his palm in her hand and covered it with the other. The Captain immediately attempted to jolt free of her grip, but it was too late. He felt the pain in his hand ebb, and once he could rip it away from her, the flesh was without any flaws, just his usual callouses from working on the ship for many hours. 
Kalani, on the other hand, had cringed and pulled her hands away just as quickly as he had pulled his own from her. Why did it hurt? She had healed him, which was an accomplishment in and of its own, but why was she, herself, hurting? The blonde looked down at both her palms. What she found made her gasp and the Captain frown, a look of guilt shining across his eyes.
There, in the same, correlating side that the man’s wound had occurred, lay a cut that could have mirrored his own. The woman watched the liquid rubies leak from under her skin. “I took it from you.” She looked back at the Captain, whose face had taken on a dark look before he carefully gripped her chin between his fingers so she would hear all that he was saying to her. 
“You tell no one that you have this power. Do you hear me? No one can know. Hell, I shouldn’t even know.” He cleared his throat and frowned again. “Never use this ability on anyone, ever. Not even me.”
Again, there he was, commanding her around. But this time, there was something in his voice that made such commands sound more like a plea. As if he could have been begging her to not go back on his words. So she abided and cast him a quiet nod."
38,"Mike was ecstatic- he had just won the position of class president, and he was filled to the brim with ideas as to how to improve his school. As a senior, he wanted to leave a legacy, and this new position of power was a dream to him; he could finally create change in his community.
However, as time went on, his excitement started to fade. Mike had tried to create spirit within his senior class, and tried to get them involved in the decisions he was making, but he realized that there was such a thing as too much democracy. Even for the color of their class t-shirts, red or white, the class split into two sides, and an uproar occurred. When white had won, the students who had chosen red began to resent Mike.
This happened in all of Mike’s decisions; there were always ones left unhappy, and they blamed Mike for their unhappiness. Mike cared deeply for his image, and hated that his position of power had left him less liked than before. He knew having the power that he did came with many responsibilities, and that there were sacrifices that must be made, but that didn’t stop him from resenting his presidency. He hated that the students so easily blamed him for everything he tried to do- choosing prom locations, allocating funds, choosing dates for events. He wanted his peers to realize how much time and effort he put in to get everything together. The president from last year did next to nothing, and was disliked for his apathy; Mike was the opposite, and there was still opposition- could Mike ever win?
“This must be how politicians feel,” Mike thought. Regardless of their decisions, there were always those who were in opposition of them.
On a brighter note, Mike was now known throughout the school, not always in the light he wanted to be cast in, but his presence throughout the school was known. He realized that he really could not please everyone, and that didn’t make him a bad leader. Besides, there were many who saw Mike’s effort in revamping the school and class, and who gave him credit for that. As the year came to a close, Mike was relieved to be lifted of his responsibility; power was not all that it was cracked up to be. But he was also very proud of his accomplishments for the school. It was much improved within the last year than it had been in the past five before that. Although he may not have received the recognition he had hoped for, he had an internal sense of pride, and had accomplished what he had originally intended to do. "
39,"One day, a man named Rob was coming back from his family’s funeral after a mass-murderer had brutally killed Rob’s daughter and wife. Rob who now became a man with nothing to lose had started to lose faith in humanity along with his own sense of humanity. Rob drank alcohol for five consecutive days in order to hide his sorrows. One late night, Rob went for a stroll around his neighborhood pondering about his meaning of life. All of a sudden, there was a loud crash which immediately caught Rob’s attention. After a minute of silence, Rob decided to head over as he did not hear any voices from the direction of the crash. A small crater with a circumference of about the size of a basketball was directly in front of Rob. There was still smoke coming out of the crater when suddenly a sharp glimmer caught Rob’s attention. In an instant, a shadowy object darted into Rob’s face…
The sunlight was shining as bright as ever and Rob was awoken by the sun’s gleaming rays. “Where am I…What happened…>?”, he said. The crater was still in front of Rob and the last recollection of his memories was of him taking a stroll at night to discover a mysterious crater. Then he remembered that something about the crater startled him. *Voosh* Rob had just seen a bench beside him get distorted for a brief moment. “What the-” Rob became nervous and thought something had happened to his eyes. He rushed back to his house opening the restroom door wide open as he nervously checked every corner of his eyes. Nothing seemed to be out of the ordinary. *sigh* “I guess nothing really happened after all… But why did I become unconscious?”, Rob said. 
*Beep Beep Beep* Rob’s phone was ringing. “Sir! I would like to ask about how things are at the moment..” “Yeah, I’m feeling a bit better. I should be able to head back to the company today after lunch.”, Rob said. “Alright, everyone will be waiting to welcome you, sir!” "
40,"Feldrich had just finished his math test when and was exiting the classroom in the building when he suddenly felt an outrageous sensation of hunger and realized that he hadn’t eaten sense that morning before school almost eight hours ago. Hurriedly, he rushed to his car to in the parking lot to drive to the Mexican restaurant down the road and grab one of his favorite carne asada burritos. The moment Feldrich hopped in his car and sat down he immediately closed his eyes and began dreaming about the delicious meat, salsa, rice and beans that would be inside the burrito and his mouth began to water at the thought of it. He decided he better not waste any time fantasizing about the food, and so he snapped out of his temporary dream-state and began to start up the car. No sooner did Feldrich become aware of a very pleasant, familiar smell in the car, and he attempted to locate the source. Upon turning around and searching the back seat of the station wagon, he was met face to face with a massive, untouched carne asada burrito on a golden platter sitting right on the seat behind him. Feldrich was blinded by the fortunate surprise and slapped himself several times rapidly in hopes of waking up from the dream he was certainly in. Despite these efforts, the burrito remained on the seat, tempting as ever, so Feldrich lunged for it and began devouring the thing like a wolf would a rabbit. Never in his entire existence on the planet had he ever experienced a satisfaction so powerful and magical, yet he questioned the source of the wondrous surprise. After school the next day, Feldrich once again realized his intense hunger and rushed to his car to speed off to grab a bite to eat. He conjoured up a burrito once again. Feldrich was magical"
41,"He was unaware of when it had happened. Or rather, he quite vividly recalled his first experience, but had no idea at what point he was capable of causing such an event. It happened several months ago, when at the start of the semester, he found himself sitting next to a particularly friendly fellow in class. After having talked to him for some time after the conclusion of lecture, he shook his hand goodbye as he promised to hang out with him outside of class. At that moment it hit him, like a powerful wave in a stormy sea, a sensation so overwhelming that it nearly brought him to his knees on the spot. In that second of contact with this individual he had never met, he had immediately come to know everything about him. He could not explain it, but "
42,"It had always puzzled Spencer why after the accident she hadn’t had any side effects. Everyone else seemed to have developed some strange traumatic brain injury, in fact some had even gone comatose. But Spencer, as far as she knew was fine. Spencer was always the bookish type, never really spent time outside; she was certainly charismatic and not what anyone would consider a shut-in, but her distaste for the outside was a notable feature of her personality. 
A long day had passed, Spencer walked out of her court-mandated therapy that everyone involved in the accident had to attend. This was a stressful time for her. What was wrong with her; why didn’t she have any problems? Why was she destined to live when everyone she had been with that day had died? Survivor’s guilt seemed like such a strange concept to her until she was in the middle of it. 
“God what is wrong with me!” she screamed out of exhaustion. She knelt down into the grass and did an action that some would consider the precursor to crying – not Spencer though, she hadn’t cried for months. 
“Believe me, nothing is wrong with you,” said a strange voice. Spencer turned around expecting this to be possibly the beginning of one of those cheesy romance movies and it would be the man of her dreams saving her from her existential crisis. Curiously though, nothing was there. She turned her head, looked to see if there was anywhere anyone was hiding but no – just the green grass she had knelt into. For a moment, she felt filled with a piety she had never felt before. 
“Ggggod? Is it you?” 
“On the contrary you are the God.” Well this was it for Spencer, she had finally suffered her traumatic brain injury and no longer felt her guilt. 
“I’m crazy,” she then began to cry. As she did this a small worm slithered up to her face and caught her tear. 
“Do not cry goddess, you are safe among your people,” the worm seemed to say. Spencer screamed. Did a worm just talk to her? And more importantly did a worm just catch her tears (and if so how thoughtful)? “Spencer,” it said in its strangely high pitched voice, “you have been given the gift. The gift of wormspeech. Many years ago it was prophesized that the wormspeaker would come to us in the form of a troubled, indoors girl who would find her people among the worms”. Spencer, believing she had gone into a psychotic state simply went along with it. “Not only that, but you can control us, here come up boys!” Suddenly a group of five worms popped out of the ground and began to bow. 
“This is Yarm, Harlo, Uback, General Tsao, and Peggy” the original worm said. “These are my siblings, and I, Campbell would love to be your worm liaison”. 
“This can’t be happening to me,” said Spencer incredulously. 
Campbell whistled a military grade whistle, “Friends of Spencer go steal that grey Toyota”. Suddenly an entire colony of worms emerged from the ground and found their way into the Corolla and started this car. 
“See,” Campbell said, “The accident you were in, it severely damaged your friends because they could not handle this burden of wormspeek. You are different Spencer. You are the chosen one. You can control any worm to your bidding and for that you are our God”. "
43,"Suddenly I was walking through the large lecture hall, on my way to my usual seat in the fourth row, 3 seats in, when I heard someone whispering. I pretended not to hear, because typically when someone is whispering they do not want it to be known. Even though the comment was about me, I chose to ignore it. Guys often comment on my body so I was used to it. I simply sat in my seat and opened my laptop while chewing my gum and texting the cute guy next door. The professor arrived in the lecture hall promptly at 2 pm, at which time the constant whispering around me stopped. Finally, peace. The professor goes on to talk about the upcoming test and what we should study, when I hear another voice. I hear “You will all fail so don’t even try to study.” I thought this was odd that a professor would encourage this. Next to me, a girl exclaims “Dr. Smith is the hottest professor I’ve ever known.” I was shocked she would actually admit that out loud. Doesn’t that cross some legal law?? Dr. Smith acted like he didn’t even hear…he must be used to it. I mean, he is pretty good looking for a 60 year old. I carried on taking notes. After class ended, Sharon and I began our daily walk to the lunch line. While in line, Sharon commented on my ugly sweater. I was offended, and since I am very sensitive, I began to cry. Sharon just looked at me confused, but the man next to me looked at me and shouted “Stop crying I am on the phone with my mistress!” I couldn’t believe it. I ran back home in tears. Sharon ended up texting me, “Why did you leave? Why were you crying?” That was when I realized my power. I, Lily Powers, could read minds. NOOOOOO, I thought to myself. Now I had to listen to everyone’s terrible, gossipy thoughts all day long. I was so upset I called my mom who lives in another state. My mom didn’t believe me, in fact, I heard her think “my daughter needs to be in a psych ward.” I was annoyed. I needed to find the silver lining. So, I went to the cute boy I was texted earlier. Cute boy, AKA Jeffrey, happened to also be on the football team at my school. As I made my way to football practice, I planned my next move. The team all gathers in the locker room after practice where it is notorious to talk about girls and all of that boy stuff. It is every girl’s DREAM to hear what they talk about. Now I get to find out! I just had to be close enough so that my super cool mind reading power could work. Slyly, I stood on the bench outside of the locker room, with my brain close to the wall so that a real connection could occur. BAZINGA! Power literally spewed out of my ears into the wall. “Damn that Dalia girl sure is a babe.” Ugh, I was so upset. (Dalia is my biggest enemy) Well that was upsetting, but what I really wanted to know was what Jeffrey had to say about me. I waited for another 20 minutes, but my name just didn’t come up. So, I decided to take action. I figured, if I walked into the room “accidently” they would HAVE to think about me. I took a nice little stroll into the boys’ locker room, where I found every football player half dressed sipping Gatorade and texting their baes. Jaws dropped. I’d like to think it was because they were amazed by my good looks and smoking bod, but none of the above is true, so I figure it’s becauase I am a girl who just walked into a strictly boys zone. It interrupts every girl/guy code. Hehe oops. Since no one was saying anything, and I was too distracted to connect my super spy mindreading powers, I left. “Lily this Lily that Lily blah blah blah” My plan was genius. My name was everywhere. Even Jeffrey was talking about me. My mind reading power caught him saying something I will never forget, “I wish Lily Powers would hit me up on tinder!” I’ve never smiled so hard in my life. In fact, my lips were so chapped I began to bleed. "
44,"There was once an unusual event that happened in the city of Ivanhoe. The day started off gloomy with a lot of rain clouds and a high chance of rain, but for this one particular boy it was as if he was being reborn. This feeling came to be because the day before while he was at school playing with his friends and one of his friends gave a juice box, however, this was not any ordinary juice box. Little did this little boy, named Stone, know about what this juice box contained. Stone drank it with much appreciation and thirst. Before he fell asleep that night he started feeling a little funny, as if he were growing more strength throughout his body. When he woke up the next morning he started off to school the next day and suddenly started running unrealistically fast, he gave a great leap and realized that he could jump over extremely high buildings and once he landed he created some sort of creator on the ground, making him realize he has the superpower of jumping really and being supernaturally strong. He started exploring the extent of his superpowers and as he was growing he started to become a hero. He would help the authority catch all the criminals with his extreme speed, strength, and jumping ability. Soon the city of Ivanhoe solely relied on the help of Stone. He was a true superhero that helped its citizens and Ivanhoe PD. Stone never came around to realize that the cause of all of this was the unordinary juice box his friend gave him thousands of years ago. Stone lived on to continue fighting crime and helping its citizens be as safe as can be. I know this because I am Stone."
45,"Up until now, Jennifer had no idea what it was. She always knew the male voice inside her head was unusual. She thought maybe it was her subconscious talking to her as a male or maybe she had some type of psychological issue. She thought she was crazy. But it was in that moment, sitting across from a guy about her age on the train, that she realized, she was reading someone’s mind all along. And it was his. 
“She’s beautiful,” the mysterious boy thought, “She has amazing eyes.” She could read every thought that went through his mind. This is insane, Jennifer thought. She couldn’t begin to fathom what was going on. All her life, she always pondered what the strange voice in her head was. Looking at him, she now knew that it was this guy all along. Too afraid to look up at him, Jennifer continued to look down, her eyes plastered to her hands in her lap and mind running rampant. 
“C’mon Andrew. Talk to her,” he was silently screaming to himself. His name’s Andrew. Jennifer found some relief in knowing at least one thing about this guy she had no idea was such a huge part of her life. I can read minds. Well, his mind at least. She was in disbelief. Hm, he thinks I’m beautiful. She smiled at this, realizing that she returns the feeling. "
